{
  "$schema": "../../shared/schemas/aos-app-v0.schema.json",
  "schema_version": 0,
  "id": "sigil",
  "title": "Sigil",
  "version": "0.1.0",
  "default_entry": "avatar",
  "content_roots": [
    {
      "id": "toolkit",
      "path": "packages/toolkit",
      "branch_scoped": true
    },
    {
      "id": "sigil",
      "path": "apps/sigil",
      "branch_scoped": true
    }
  ],
  "status_item": {
    "enabled": true,
    "toggle_entry": "avatar",
    "toggle_track": "union"
  },
  "entries": {
    "avatar": {
      "summary": "Launch the Sigil avatar surface.",
      "surfaces": [
        {
          "id": "avatar-main",
          "url": "aos://${root:sigil}/renderer/index.html?toolkit-root=${root:toolkit}",
          "track": "union",
          "create_if_missing": true,
          "wait_js": "typeof window.liveJs === \"object\"",
          "wait_timeout": "5s"
        }
      ],
      "verify_surfaces": ["avatar-main"]
    },
    "legacy-workbench": {
      "summary": "Launch the historical Sigil avatar and workbench surfaces for explicit dev use only.",
      "requires_entries": ["avatar"],
      "remove_surfaces": ["sigil-workbench", "avatar-main"],
      "hooks": [
        {
          "phase": "before_surfaces",
          "script": "apps/sigil/sigilctl-seed.sh",
          "argv": ["--mode", "${mode}"]
        }
      ],
      "surfaces": [
        {
          "id": "avatar-main",
          "url": "aos://${root:sigil}/renderer/index.html?toolkit-root=${root:toolkit}",
          "track": "union",
          "wait_js": "typeof window.liveJs === \"object\"",
          "wait_timeout": "5s"
        },
        {
          "id": "sigil-workbench",
          "url": "aos://${root:sigil}/workbench/index.html?toolkit-root=${root:toolkit}",
          "interactive": true,
          "focus": true,
          "frame": {
            "kind": "workbench"
          },
          "wait_js": "!!document.querySelector(\".surface-frame\")",
          "wait_timeout": "5s"
        }
      ],
      "post_launch": [
        {
          "kind": "show_eval",
          "surface": "avatar-main",
          "js": "(function(){if(!window.liveJs) return 'no-liveJs'; var p={x:${surface_home_x},y:${surface_home_y},valid:true}; liveJs.travel=null; liveJs.avatarPos=p; liveJs.currentCursor=p; liveJs.cursorTarget=p; if(typeof postLastPositionToDaemon==='function') postLastPositionToDaemon(); return 'staged';})()",
          "success_match": "\"staged\"",
          "retries": 10,
          "retry_delay_ms": 200
        },
        {
          "kind": "show_post",
          "surface": "sigil-workbench",
          "event": {
            "type": "log/append",
            "payload": {
              "level": "info",
              "text": "Workbench ready."
            }
          }
        }
      ],
      "verify_surfaces": ["avatar-main", "sigil-workbench"]
    }
  }
}
